"","artist_full_name","art_title","art_location_name","art_location_street_address","art_location_city","art_location_state","art_location_zip","art_full_address","art_location_long","art_location_lat"
"161","Elementary School Children From Dove Springs Area","Untitled","Southeast Austin Community Branch","5803 Nuckols Crossing","Austin","TX",78744,"5803 Nuckols Crossing; Austin TX 78744",-97.7419605,30.1876224
"162","Glenna Goodacre","Philosophers Rock","Zilker Park (Barton Springs Pool)","2201 Barton Springs Rd.","Austin","TX",78704,"2201 Barton Springs Rd.; Austin TX 78704",-97.7706985,30.2636355
"163","Lars A.Stanley","Fire in the Heart","Firestation #17","4123 South First St.","Austin","TX",78745,"4123 South First St.; Austin TX 78745",-97.7704887,30.2244313
"164","Roberto Behar","Open Room Austin","Sand Beach Park","","Austin","TX",78701,"; Austin TX 78701",-97.7443863,30.2729209
"165","John Christensen","The Source","Waller Creek Center","625 East 10th Street","Austin","TX",78701,"625 East 10th Street; Austin TX 78701",-97.7347146,30.2696169
"167","Joe Arellano","The Children are the Future","Holly Street Power Plant","2400 Holly St.","Austin","TX",78702,"2400 Holly St.; Austin TX 78702",-97.7192254,30.2497726
